Dept_Name,Agency_Name,2024_Actual_General_Administration_and_Support,2024_Actual_Support_to_Operations,2024_Actual_Locally_Funded_Projects,2024_Actual_Foreign_Assisted_Projects,2024_Actual_Other_Projects,2024_Actual_Total,2025_Program_General_Administration_and_Support,2025_Program_Support_to_Operations,2025_Program_Locally_Funded_Projects,2025_Program_Foreign_Assisted_Projects,2025_Program_Other_Projects,2025_Program_Total,2026_GAA_General_Administration_and_Support,2026_GAA_Support_to_Operations,2026_GAA_Locally_Funded_Projects,2026_GAA_Foreign_Assisted_Projects,2026_GAA_Other_Projects,2026_GAA_Total,Page_No
Congress of the Philippines (CONGRESS),None,22059857,0,16430074,6571567,0,45061498,20378486,0,26194452,4243435,0,50816373,22889904,0,16540366,0,0,39430270,1
Office of the President (OP),None,2980310,0,6738500,0,0,9718810,3056496,0,7449705,5400000,0,15906201,2384776,0,8167182,17552695,0,28104653,1
Office of the Vice-President (OVP),None,129732,0,1653555,0,0,1783287,119921,0,624225,0,0,744146,247227,0,655668,0,0,902895,1
Department of Agrarian Reform (DAR),None,3122880,762116,11098080,20149,5493206,20496431,2309410,1711396,6000232,0,1080111,11101149,2494964,1242193,8114850,0,6308648,18160655,1
Department of Agriculture (DA),None,4164195,6669375,64479950,26656407,9492401,111462328,3258537,6930562,53492023,47039903,14721578,125442603,4189370,9351169,63922886,95219951,13830058,186513434,1
Department of Budget and Management (DBM),None,1155674,428050,664296,295107,0,2543127,1391945,628730,587413,583747,0,3191835,1564990,671116,710375,622653,0,3569134,1
Department of Education (DepEd),None,48090783,6745474,704763719,379131,205,759979312,21640731,5181367,752591616,2252296,505024,782171034,31356573,10713482,963261343,130000,9848279,1015309677,1
State Universities and Colleges (SUCs),None,20775359,1850228,63671717,47123393,0,133420697,23274409,2152454,62254643,39545998,0,127227504,25978671,2381371,101411180,14298310,0,144069532,1
Department of Energy (DOE),None,648318,485273,659507,860298,0,2653396,684698,670429,834063,896014,0,3085204,677121,766651,2990388,0,0,4434160,1
Department of Environment and Natural Resources (DENR),None,6429094,3541500,15412081,1466737,6213,26855625,5521057,4134282,16300162,1336730,0,27292231,6419343,3797570,16708615,1342748,0,28268276,1
Department of Finance (DOF),None,28605050,678201,33279076,485185,272469,63319981,6676131,773848,24479035,561084,0,32490098,7159011,1011272,24051376,571184,400021,33192864,1
Department of Foreign Affairs (DFA),None,5878098,15379,15219903,0,0,21113380,5291740,110371,22450688,0,0,27852799,7419879,125312,21361840,0,0,28907031,1
Department of Health (DOH),None,18326950,2918944,207200357,47561243,1887802,277895296,14639581,2305090,233693955,1284280,1437863,253360769,18318021,1140721,276173905,284280,8669531,304586458,1
Department of Human Settlements and Urban Development (DHSUD),None,1305800,194638,945177,139566,0,2585181,927276,585499,1458453,777818,0,3749046,860998,166349,952821,35000,0,2015168,1
Department of Information and Communications Technology (DICT),None,1273865,54441,3952899,9529058,0,14810263,1684029,658168,4831464,7924100,0,15097761,1736314,94352,6360026,6771862,3255123,18217677,1
Department of the Interior and Local Government (DILG),None,98470669,1579794,234503979,7217579,0,341772021,21235839,1769478,248586947,10372186,0,281964450,24261863,1821543,273902233,10486492,0,310472131,1
Department of Justice (DOJ),None,11178948,808627,25446635,658777,0,38092987,8810103,1108610,28226149,4043510,0,42188372,10459331,832044,32136200,2097315,0,45524890,1
Department of Labor and Employment (DOLE),None,4060344,91782,59862848,361609,40096,64416679,4164686,871065,43354413,281883,3082047,51754094,4052557,589837,56431496,288980,447829,61810699,1
Department of Migrant Workers (DMW),None,2402879,0,8093969,0,0,10496848,1635102,0,7114257,0,0,8749359,2041463,0,9703764,0,0,11745227,1
Department of National Defense (DND),None,103729796,0,210504360,39177606,0,353411762,43934929,0,228024409,4014485,0,275973823,45170491,0,253485071,11340737,0,309996299,1
Department of Public Works and Highways (DPWH),None,15153443,23028703,1091297263,65379810,44853962,1239713181,14324565,10436885,1023285908,17752950,23000000,1088800308,17815695,29705871,458074281,7606388,17696626,530898861,1
Department of Science and Technology (DOST),None,2135135,569413,22925417,1899540,0,27529505,2109890,462930,23662588,2759265,0,28994673,2325346,717191,25039399,4042431,0,32124367,1
Department of Social Welfare and Development (DSWD),None,3581894,2140351,237343945,33816786,4644916,281527892,2804146,1704144,179192107,32813132,1023488,217537017,3050918,1425547,258684036,7028900,0,270189401,1
Department of Tourism (DOT),None,1044888,99253,1486541,679002,0,3309684,1051327,89378,2656904,100000,0,3897609,1182786,69648,2897692,75000,0,4225126,1
Department of Trade and Industry (DTI),None,2544142,93278,3843600,2639263,565277,9685560,3106476,33170,4291002,1772256,496190,9699094,3257415,38997,5188497,1180811,496190,10161910,1
Department of Transportation (DOTr),None,26682179,12178020,20535447,23247902,103097371,185740919,16926725,8594745,24042247,17771487,20662894,87998098,16217941,6415573,38086052,13052287,64074535,137846388,1
Department of Economy Planning and Development (DEPDev),None,2996437,361921,3667980,8399427,0,15425765,3713301,637214,3965128,4319349,0,12634992,3694255,534094,4346900,4529731,846150,13951130,1
Presidential Communications Office (PCO),None,821950,0,1604856,45757,0,2472563,730234,0,1438700,0,0,2168934,763611,0,1786337,0,0,2549948,1
Other Executive Offices (OEOs),None,5957821,396098,42027650,9871614,132649,58385832,6435792,772070,48512982,9549183,0,65270027,6479914,1225133,63186484,11462721,36951,82391203,1
The Judiciary (JUD),None,15482191,985796,39227233,5366415,0,61061635,24506343,690571,31135648,7680338,0,64012900,24158546,1529136,35447540,9475647,0,70610869,1
Civil Service Commission (CSC),None,1170397,232853,915690,136710,0,2455650,1077789,797265,965918,42257,0,2883229,1112104,426772,1085508,43018,333810,3001212,1
Commission on Audit (COA),None,7240469,572433,7373554,0,0,15186456,6344999,468241,6804100,0,0,13617340,7137045,544755,7929103,0,0,15610903,1
Commission on Elections (COMELEC),None,1762022,0,6326880,22804026,0,30892928,1617065,0,3477813,30407793,0,35502671,1722881,0,3465523,15007909,0,20196313,1
Office of the Ombudsman (OMB),None,4123678,56569,1453501,109000,0,5742748,4090594,65450,1607110,109000,0,5872154,4359254,148990,1960247,109000,0,6577491,1
Commission on Human Rights (CHR),None,428783,125111,515536,3320,0,1072750,448663,199453,548156,0,0,1196272,492588,238579,681077,0,0,1412244,1
Budgetary Support to Government Corporations (BSGC),None,20582174,13457460,154592615,49514069,7581620,245727938,0,0,0,21000000,0,21000000,0,0,0,39822355,0,39822355,3
Allocations to Local Government Units (ALGU),Fund ),0,0,0,0,0,0,0,0,0,13000000,0,13000000,0,0,0,13000000,0,13000000,3
Contingent Fund,None,0,0,0,0,0,0,0,0,0,109127872,0,109127872,0,0,0,77047627,0,77047627,3
Miscellaneous Personnel Benefits Fund,None,0,0,0,0,0,0,0,0,0,144724175,0,144724175,0,0,0,165518761,0,165518761,3
Pension and Gratuity Fund,None,0,0,0,0,0,0,0,0,0,35000000,0,35000000,0,0,0,40000000,0,40000000,3
Revised AFP Modernization Program,None,0,0,0,0,0,0,0,0,0,14500000,0,14500000,0,0,0,14500000,0,14500000,3
Customs duties and taxes including tax expenditures,None,0,0,0,0,0,0,294149096,65054969,3172739606,1851640746,66009195,5449593612,327057487,88848153,3262029996,2004498000,132028364,5814462000,3
